"abstracts","annotation_id","annotator","created_at","id","lead_time","sentiment","updated_at""Fine-needle aspiration biopsy of head and neck lesions. The case records of 213 fine-needle aspiration biopsies (FNAB) of head and neck masses performed on 209 patients over a 3-year period were reviewed to assess the diagnostic accuracy and safety of this technique in comparison with surgical histologic examination. Cytologic diagnoses based on FNAB were compared with histologic diagnoses in 110 patients who underwent surgery. Based on cytology alone, 40.3% of the lesions were reported as malignant, 45.1% as benign, and 14.6% as indeterminant. A specific cytologic diagnosis was made in 85.5% of the cases. Cytologic diagnoses concurred with surgical histologic diagnoses 90% of the time. Fine-needle aspiration biopsy was found to have a false-positive rate of 0.5% and a false-negative rate of 2.3%. The sensitivity and specificity of FNAB in determining a malignant diagnosis were 81.1% and 99%, respectively. Positive and negative predictive values were calculated at 98.9% and 82.8%, respectively. Diagnostic rate, sensitivity, and negative predictive value increased consistently throughout the study period, indicating that the diagnostic accuracy of FNAB improved with experience.",164,"1","2024-04-24T20:54:38.727029Z",160,16.93,"5","2024-04-24T20:54:38.727029Z"
"Adverse mortality experience of a southwestern American Indian community: overall death rates and underlying causes of death in Pima Indians. As part of an ongoing epidemiologic study, the death rate and causes of death during 1975 through 1984 were determined in Pima Indians who resided in the Gila River Indian Community (GRIC) in 1965 and later. Death certificates were available for 677 of the 681 deaths. In 78% of the deaths, the underlying cause recorded on the death certificate agreed with the cause determined after review of all available relevant records. The age- and sex-adjusted average annual death rate for the GRIC population (1639/100,000) was 1.9 times (95% CI 1.7-2.0) the 1980 rate for the U.S. all races (878/100,000). In Pima males, whose death rate was substantially higher than that of Pima females, the age-adjusted death rate was 2.3 times that in U.S. males, all races. Moreover among males 25-34 years of age, the Pima death rate was 6.6 times that for the U.S. all races. Diseases of the heart and malignant neoplasms caused 59% of U.S. deaths in 1980, but only 19% of GRIC deaths. By contrast, the age- and sex-adjusted mortality rate in the GRIC Pima was 5.9 times the rate of the U.S. all races for accidents, 6.5 times for cirrhosis, 7.4 times for homicide, 4.3 times for suicide, and 11.9 times for diabetes. Tuberculosis and coccidioidomycosis were important causes of death in the Pima, for whom infectious diseases was the tenth leading cause of death. The findings indicate that programs to improve the adverse mortality experience of the GRIC population should emphasize factors related to fatal accidents, alcoholic cirrhosis, homicide, suicide, diabetes mellitus, and infectious diseases. Young Pimas, especially the males, should be the primary focus of such preventive efforts. These findings and recommendations probably apply to many Native American populations.",165,"1","2024-04-24T20:54:59.962948Z",161,20.059,"5","2024-04-24T20:54:59.962948Z"
"Evaluating oxygen delivery and oxygen utilization with mixed venous oxygen saturation monitoring: a case study approach. Three cases studies are presented to demonstrate clinical application of mixed venous oxygen saturation (SvO2) monitoring in critical care nursing practice. Examples of critically ill patients are used to demonstrate how SvO2 monitoring can be used in clinical practice to reflect an imbalance between oxygen delivery and oxygen utilization. In the first case, the patient had a problem with oxygen delivery. Continuous SvO2 data aided nurses in guiding, adjusting, and assessing therapy. The second case demonstrates how SvO2 monitoring can provide an early sign of a life-threatening complication. The final case is one in which the patient had a problem with oxygen utilization. In all the cases, continuous SvO2 data provided important information about the balance between oxygen delivery and oxygen utilization.",166,"1","2024-04-24T20:55:18.000582Z",162,16.963,"5","2024-04-24T20:55:18.000582Z"
"Anaphylactoid reactions during hemodialysis on AN69 membranes in patients receiving ACE inhibitors. We report five life-threatening anaphylactoid reactions occurring within the very first minutes of hemodialysis on polyacrylonitrile (AN69) capillary dialyzers in three patients receiving ACE inhibitors. Such reactions were not observed either in patients treated with ACE inhibitors but dialyzed on other membranes (N = 9), nor in patients on AN69 who did not receive ACE inhibitors (N = 19). These anaphylactoid reactions could be due to bradykinin accumulation, as a result of both increased synthesis--by interaction of blood with the AN69 polymer--and catabolism blockade by ACE inhibitors.",167,"1","2024-04-24T20:55:28.737707Z",163,9.613,"5","2024-04-24T20:55:28.737707Z"
"Dexamethasone-nonsuppressible cortisol in two cases with aldosterone-producing adenoma. Forty-one patients with aldosterone-producing adenoma (APA) were subjected to a dexamethasone suppression test (DST) before surgery. Serum cortisol and urinary excretion of 17-hydroxycorticosteroids were suppressed by dexamethasone in 39 patients [DST(+)]. In two patients (cases A and B), they were not suppressed [DST(-)]. Clinical manifestations of the two DST(-) patients were similar to those of DST(+) patients. Hypertension, hypokalemia, high serum aldosterone levels, and suppressed PRA were found in all of the patients. The cut surfaces of the adenomas from all of the patients, including cases A and B, were golden yellow, which is typical of APA. However, atrophies of the adjacent normal tissues were evident exclusively in the two DST(-) patients. After removal of the affected adrenals, the serum cortisol level was suppressed by dexamethasone in one of the DST(-) patients (case B). These findings suggested autonomous cortisol production by APA. To evaluate whether cortisol could be produced from the adenoma tissue, the presence of several steroidogenic enzymes was studied by immunohistochemistry and mRNA analysis in the adenomas and the adjacent nonneoplastic adrenals from the 2 DST(-) and 5 DST(+) patients. Immunohistochemical analysis demonstrated that steroidogenic enzymes were expressed in APA tumor tissues from both DST(-) and DST(+) patients. In both groups, mRNAs coding steroidogenic enzymes were present not only in the nonneoplastic but also in the tumor tissues. Quantitative analysis of the mRNA levels revealed that in the adrenals from DST(+) patients, the mRNAs were more abundant in nonneoplastic tissue than in tumor tissue. However, in those from DST(-) cases, the mRNAs were much more abundant in the tumor tissues than in the nonneoplastic tissues. These results indicate that tumor cells of the two DST(-) patients autonomously synthesized not only aldosterone but also cortisol. The diameters of the tumors from the two DST(-) patients exceeded 3 cm, while those from other DST(+) patients were smaller. In patients with large APA, adrenal insufficiency should be anticipated upon removal of the tumor.",168,"1","2024-04-24T20:56:12.549519Z",164,40.611,"1","2024-04-24T20:56:12.549519Z"
"Assessment of experimental pericardial effusion using nuclear magnetic resonance imaging techniques. An experimental canine model of pericardial effusion was designed to validate previous clinical nuclear magnetic resonance imaging (NMR) studies. Saline (n = 7), serum (n = 4), blood (10% hematocrit [n = 5]; 20% hematocrit [n = 5]), and lipid (n = 4) effusions were chosen to resemble: (1) transudative/exudative, (2) nonhemorrhagic/hemorrhagic, and (3) chylous effusions, respectively. There was a linear correlation between the infused volume and the pericardial/epicardial distance measurements on the nuclear magnetic resonance images. Hemorrhagic and nonhemorrhagic exudative effusions were distinguished from transudative effusions by the low signal intensity of transudative effusions images obtained at a TR (repetition time) of 400 and 800 msec. Nonhemorrhagic effusions had significantly lower effusion-to-myocardial signal intensity ratio at TR of 400 msec than did hemorrhagic effusions. Differences in hematocrit were not appreciated qualitatively or quantitatively. Compared with other effusion types, only chylous effusions were hyperintense to myocardium at a TR of 400 msec. Chylous effusions were further uniquely characterized by a decreasing effusion-to-myocardial signal intensity ratio with increasing TR. These experimental findings corroborate the findings of earlier clinical reports and suggest that NMR can provide important assistance in the evaluation of pericardial effusions.",169,"1","2024-04-24T20:56:31.591343Z",165,16.876,"4","2024-04-24T20:56:31.591343Z"
"Skeletal muscle as an alternative specimen for alcohol and drug analysis. In a random group of medical examiner cases, muscle tissue, as well as blood and vitreous humor, was analyzed for ethyl alcohol, and the results were compared. When the blood concentration was greater than 0.10 g/dL, the muscle to blood ratio was 1.00 or less (average 0.94), and when the blood concentration was less than 0.10 g/dL, this ratio was greater than 1.00 (average 1.48). The author proposes that this ratio is dependent upon the time course of absorption and distribution, as has been observed for vitreous humor, but with a more rapid equilibration. Muscle tissue was also analyzed in another group of cases found to be positive for one or more drugs in blood. The concentrations of the drugs in muscle varied from none detected to 6.5 times those in blood and seemed to be dependent on the time course between ingestion and death, as well as on the nature of the drug. For most common basic drugs, the ratios were often near unity. Muscle is proposed as a useful alternative specimen to postmortem blood.",170,"1","2024-04-24T20:56:41.759842Z",166,8.471,"5","2024-04-24T20:56:41.759842Z"
"Altered expression of the retinoblastoma gene product in human sarcomas. BACKGROUND. The retinoblastoma-susceptibility (Rb) gene is a prototype tumor-suppressor gene originally isolated from patients with heritable retinoblastoma. This gene encodes a nuclear phosphoprotein whose expression is altered in several types of human tumors. METHODS. We studied the expression of the Rb protein in 44 primary and 12 metastatic high-grade human sarcomas by means of immunohistochemical methods and Western blotting. Computerized image analysis was used to quantify the level of Rb gene product in individual tumor cells. The expression of the Rb gene was then correlated with clinical outcome in the patients with primary tumors. RESULTS. Of the 44 patients with primary sarcomas, 13 (30 percent) had tumors with normal, homogeneous expression of the Rb protein in essentially all tumor cells. Thirty-one patients with primary tumors (70 percent) had altered Rb expression; in 18 (40 percent) the Rb protein was heterogeneously expressed, and in 13 (30 percent) it was detected in fewer than 20 percent of the tumor cells. All 12 of the patients with metastatic sarcomas had altered expression of the Rb protein. When the findings in the patients with primary tumors were correlated with clinical outcome, survival was found to be significantly increased in the patients whose tumors had homogeneous Rb expression, as compared with those with either heterogeneous expression (P = 0.026) or no expression (P = 0.012). CONCLUSIONS. Tumors in which the expression of Rb gene product was decreased were more aggressive than tumors in which this protein was expressed by nearly all cells. The Rb gene product may be an important prognostic variable in patients with these tumors.",171,"1","2024-04-24T20:56:49.872535Z",167,6.653,"1","2024-04-24T20:56:49.872535Z"
"Pharmacokinetics and clinical experience of 20-h infusions of methohexitone in intensive care patients with postoperative pyrexia. We have studied the pharmacokinetics of 20-h infusions of methohexitone in young patients with postoperative fever undergoing artificial ventilation of the lungs. The infusion rate was adjusted so that patients were unresponsive to vocal stimulation but reacted to tracheal suction. The mean steady state concentration of methohexitone required was 2.6 mg litre-1 (unbound 0.53 mg litre-1). The mean (SD) total clearance of methohexitone was 16.3 (4.2) ml min-1 kg-1, which is greater than that for volunteers or normal surgical patients. The unbound clearance correlated positively with body temperature during the infusion (r = 0.796, P = 0.017). The terminal half-life of methohexitone was 6.3 (3.8) h and that of the 4'-hydroxy metabolite 5.8 (2.1) h. There were no marked haemodynamic effects of the infusion, and no excessive sedation after the infusion. However, the clearance of methohexitone was high and variable, possibly as a direct effect of postoperative fever. Consequently, the need for individual titration of the rate of infusion is emphasized.",172,"1","2024-04-24T20:57:01.432799Z",168,10.125,"5","2024-04-24T20:57:01.432799Z"
"Simplified technique for isolating vascularized rib periosteal grafts. A modified technique for obtaining a vascularized rib periosteal segment utilizing the posterolateral approach is presented. The technique avoids the inclusion of a large muscle cuff or the pleura around the isolated rib segment and therefore minimizes donor-site morbidity and chest complications previously associated with this approach.",173,"1","2024-04-24T20:57:49.214332Z",169,42.519,"5","2024-04-24T20:57:49.214332Z"
"The surgical management of chronic parotitis. Chronic parotitis is a disorder characterized by recurrent painful swelling of the gland with purulent sialorrhea. Occasionally, the condition fails to respond to medical management and definitive surgical therapy is necessary. Sialolithiasis is the usual etiology in cases of parotitis, although occasionally severe recurrent parotid infections are superimposed on underlying Sjogren's disease. Total parotidectomy with facial nerve dissection has been used in such cases in our department and has proved to be an excellent way to manage this disease. A summary of our results indicate that the recurring infections were eradicated and that the complication rate is tolerable, considering the magnitude of the problem. We feel that it is better to use surgical management early rather than wait for the formation of fistulae or abscesses.",174,"1","2024-04-24T20:58:00.876962Z",170,10.355,"5","2024-04-24T20:58:00.876962Z"
"Functional results of facial nerve suture after removal of acoustic neurinoma: analysis of 25 cases. The facial nerve is sometimes severed during the removal of acoustic neurinomas, either intentionally to ensure complete removal, or unintentionally because of difficulties in identification. In such cases we have, if possible, sutured the nerve stumps microsurgically, either end to end or by use of an intervening nerve graft. We analyzed the outcome of 25 instances of facial nerve suturing in a series of 219 patients operated on for acoustic neurinoma from 1979 to 1987. The first signs of recovery appeared at an average of 12 months, and there was continued improvement for several years. Recovery was graded from 1 to 6. The anastomosis was successful in 24 of the 25 sutured nerves, in that at least some facial movement and tone were restored (Grade 5 or higher). In 11 of the 25 cases, facial appearance at rest and with movement was moderately good (Grade 2 or 3). A Grade 1 result, with no perceivable facial dysfunction, was never achieved. Typically, oral muscles showed the most improvement and frontal muscles the least. Facial appearance was better at rest than with movement, which was always complicated by some degree of synkinesis. Closure of the eye was so good in 13 of the 25 cases that neither tarsorrhaphy nor an eyelid spring was necessary. When the facial nerve is severed, intraoperative suture is recommended, because it provides a chance for moderately good restoration of facial appearance.",175,"1","2024-04-24T20:58:25.727019Z",171,23.658,"3","2024-04-24T20:58:25.727019Z"
"Localization of technetium-99m-glucarate in zones of acute cerebral injury. The potential structural similarity of technetium-99m-labeled glucaric acid (99mTc-glucarate) to that of fructose suggests that this agent may enter cells by a sugar transport system. Studies with LLC-PK1 cells demonstrated inhibition of 99mTc-glucarate uptake by fructose, confirming this potential relationship. Since anaerobic metabolism can use either glucose or fructose, we hypothesized that 99mTc-glucarate may concentrate in areas of acute ischemic injury. To test this hypothesis, 63 adult rats with middle cerebral artery (MCA) occlusion followed by reperfusion were injected with 99mTc-glucarate and in vivo and ex vivo images were acquired. Seven animals were also studied with 18FDG and high resolution PET imaging. The radionuclide images were compared to the results of triphenyl tetrazolium chloride (TTC) staining and conventional histopathology. Thirty-five rats had significant accumulation of 99mTc-glucarate and no TTC staining (indicating infarction) in the involved hemisphere. Of the remaining 28 rats with TTC staining (suggesting viability) of the involved hemisphere, 16 (57%) had 99mTc-glucarate accumulation. In the seven rats that were studied with both 99mTc-glucarate and 18FDG, 99mTc-glucarate accumulated at the center of the occluded MCA territory while 18FDG activity was decreased in this region. These results suggest that 99mTc-glucarate is a sensitive marker of acute severe cerebral injury, but its mechanism of localization is probably different from that of 18FDG.",176,"1","2024-04-24T20:58:35.137438Z",172,8.05,"3","2024-04-24T20:58:35.137438Z"
"Risk of cancer death in first-degree relatives of patients with hereditary non-polyposis cancer syndrome (Lynch type II): a study of 130 kindreds in the United Kingdom. To estimate the relative risks of cancer in first-degree relatives of index patients, 130 pedigrees of dominantly inherited Lynch type II cancer family syndrome have been analysed. The risk of death from all causes was significantly increased in women over 45 years of age and the overall liability to cancer in women was greater than for men. A sevenfold increase in risk of colon cancer was found in both sexes. In female relatives the risk of breast cancer was increased fivefold and lifetime risk of breast cancer was 1 in 3.7. A screening programme based on estimated risks could be offered to first-degree relatives of index patients with Lynch type II cancer family syndrome.",177,"1","2024-04-24T20:58:51.367666Z",173,13.417,"1","2024-04-24T20:58:51.367666Z"
"Inflammatory myofibroblastic tumor (plasma cell granuloma). Clinicopathologic study of 20 cases with immunohistochemical and ultrastructural observations. Twenty cases of inflammatory myofibroblastic tumor (IMT) were studied; 19 involved the lung and 1 the esophagus only. The patients' ages ranged from 3 to 72 years. There were 9 males and 11 females. Involvement of a bronchus was seen in one case and of mediastinal structures in four. Chest pain and dyspnea were common symptoms; eight patients were asymptomatic. Seven patients underwent lobectomy, 12 local excision, and 1 biopsy alone. The lesions were nonencapsulated and ranged from 1.2 to 15 cm. Various proportions of plasma cells, histiocytes, and spindle cells were observed; the latter corresponded ultrastructurally to fibroblasts and myofibroblasts, were immunoreactive for vimentin and actin and focally for desmin, and were negative for epithelial markers. Plasma cells were polyclonal for light chains. One patient had two recurrences, and in one case a large pleural IMT was found eight years after the excision of a similar lesion in the lung. All patients with follow-up (ten) were well as long as ten years after the diagnosis (average, 3.7 years).",178,"1","2024-04-24T20:59:07.729667Z",174,15.209,"1","2024-04-24T20:59:07.729667Z"
"Use of single internal mammary artery grafts in older patients. The indications for use of the internal mammary artery as a coronary bypass conduit in older patients are not clearly established. Between January 1985 and December 1988, 786 patients received single internal mammary artery grafts alone (717) or in conjunction with other procedures (69). Of these patients, 341 were 65 years of age or older (mean, 69.3 years). This group was compared with those patients less than 65 years of age (mean, 56.2 years). There were no significant differences between the two groups in the incidence of diabetes mellitus; the number of distal coronary anastomoses; left ventricular wall motion score; the frequency of isolated bypass procedures, reoperations, or emergent operations; or the durations of aortic clamping and cardiopulmonary bypass. The older group contained more women (34.9% versus 20.7%) and more patients with left main coronary artery disease (15.5% versus 9.4%) (p less than 0.01). No significant differences in the frequency of reoperation for hemorrhage, perioperative infarction, neurological deficits, requirements for intra-aortic balloon pumping, sternal wound infections, necessity for prolonged ventilatory support, or 30-day mortality (2.7% versus 3.2%) were observed. The length of postoperative hospitalization was greater in the older group (11.8 versus 10.2 days) (p = 0.02). Blinded histological examination of biopsies from 61 internal mammary artery grafts (34 patients less than 65 years, 27 patients greater than or equal to 65 years) showed no significant differences in luminal area or wall thickness. No significant degenerative changes were observed in either group. We conclude that the use of the internal mammary artery for bypass grafting in older patients is safe and may provide long-term benefit.",179,"1","2024-04-24T20:59:40.826881Z",175,31.629,"4","2024-04-24T20:59:40.826881Z"
"Myocarditis simulating acute transmural myocardial infarction. A patient with cardiogenic shock had typical electrocardiographic findings of acute anterior transmural myocardial infarction. Cardiac catheterization revealed normal coronary arteries and severe biventricular failure. Postmortem examination confirmed normal coronary arteries; acute myocarditis, but no evidence for infarction, was found. Electrocardiographic changes of myocarditis may be indistinguishable from acute transmural infarction. In suspected cases, cardiac catheterization should be considered prior to thrombolytic therapy.",180,"1","2024-04-24T20:59:48.722633Z",176,6.437,"4","2024-04-24T20:59:48.722633Z"
"Risks factors for cerebral infarction in good-grade patients after aneurysmal subarachnoid hemorrhage and surgery: a prospective study. A prospective series of 265 patients with aneurysmal subarachnoid hemorrhage (SAH) of Grades I to III (Hunt and Hess classification) upon admission were evaluated as to neurological outcome and computerized tomography (CT) findings 1 to 3 years (mean 1.4 years) after the SAH and surgery. A total of 73 patients underwent acute surgery (within 72 hours after the bleed: Days 0 to 3), 86 were operated on subacutely (between Days 4 and 7), and 91 had late surgery (on Day 8 or later). Fifteen patients died before surgery was undertaken and another 20 patients died during the follow-up period. A total of 104 patients received nimodipine and the rest of the patients received either placebo (109 patients) or no medication (52 patients). A logistical regression analysis revealed the following prognostic factors for cerebral infarction, in order of importance: the amount of blood on the primary CT scan; postoperative angiographic vasospasm; the timing of the operation; and a history of hypertension. The use of nimodipine was associated with a significant reduction of cerebral infarcts visualized by CT scanning in patients who received intermediate or late surgery. In patients who underwent acute surgery no significant difference between the incidence of cerebral infarcts was observed.",181,"1","2024-04-24T21:00:00.526066Z",177,10.388,"3","2024-04-24T21:00:00.526066Z"
"Snow skiing for the physically disabled. The sport of snow skiing by the physically disabled, which originated in Europe in 1935 and first received attention in the United States in the 1940s, is reviewed in terms of opportunities available, instructions, adaptive equipment necessary, and benefits provided. Persons with a wide variety of disabilities (such as cerebral palsy, multiple sclerosis, spinal cord injury, hemiplegia, amputation, blindness, spina bifida, and muscular dystrophy) can participate. Accordingly, a wide range of adaptive equipment is available--including outrigger skis, flip-skis, canting wedges, ski bras, ""toe spreaders,"" sit-skis, and mono-skis--to allow safe enjoyment of the sport. Programs for instruction of the disabled skier are increasing in number and popularity, and numerous opportunities are available to enter competitive events sponsored by National Handicapped Sports. Both the participants and the instructors relate the numerous physical and psychologic benefits that can be derived from skiing; the sport provides an almost universal enjoyment of the sense of freedom and independence. Snow skiing is an enjoyable, beneficial, outdoor cold-weather activity that the disabled population can safely learn with proper instruction.",182,"1","2024-04-24T21:00:13.289867Z",178,11.669,"5","2024-04-24T21:00:13.289867Z"
