"abstracts","annotation_id","annotator","created_at","id","lead_time","sentiment","updated_at""Direct measurement of skeletal muscle fatigue in patients with chronic heart failure. Skeletal muscle function was measured as force production and fatigue in both the quadriceps (a large locomotive muscle) and adductor pollicis (a small intrinsic hand muscle) in five healthy volunteers, five patients with mild chronic heart failure, and five patients with severe chronic heart failure. The quadriceps of patients with chronic heart failure had a reduced muscle cross sectional area, a reduced maximum isometric force production, and an increased tendency to fatigue. Isometric force production and fatigue of the adductor pollicis, however, were not significantly different between the three groups under control conditions. But during circulatory occlusion fatigue in the adductor pollicis increased more in the patients with severe chronic heart failure. These differing findings in quadriceps and adductor pollicis suggest that skeletal muscle atrophy and reduced isometric force production are not a necessary consequence of chronic heart failure per se, because they were only present in the large locomotive muscle. The normal values for muscle fatigue observed in adductor pollicis in patients with chronic heart failure imply that skeletal muscle blood flow must increase normally during muscle activation when only a small muscle mass is used. These results are not compatible with the concept of a generalised impairment of normal vasodilatation within active skeletal muscle. In contrast, activation of a large muscle, such as quadriceps, results in the rapid onset of fatigue in patients with severe chronic heart failure. This fatigue may be related to the inability of the cardiovascular system to provide the required blood flow for the activation of a large muscle mass.",200,"1","2024-04-24T21:06:44.793678Z",196,15.72,"4","2024-04-24T21:06:44.793678Z"
"Micromotion of cemented and uncemented femoral components. We evaluated the initial stability of cemented and uncemented femoral components within the femoral canals of cadaver femurs during simulated single limb stance and stair climbing. Both types were very stable in simulated single limb stance (maximum micromotion of 42 microns for cemented and 30 microns for uncemented components). However, in simulated stair climbing, the cemented components were much more stable than the uncemented components (76 microns as against 280 microns). There was also greater variation in the stability of uncemented components in simulated stair climbing, with two of the seven components moving 200 microns or more. Future implant designs should aim to improve the initial stability of cementless femoral components under torsional loads; this should improve the chances of bony ingrowth.",201,"1","2024-04-24T21:07:06.554949Z",197,16.03,"5","2024-04-24T21:07:06.554949Z"
"Effect of hydrocele on testis and spermatogenesis. One hundred and twenty cases of big unilateral hydrocele of the tunica vaginalis testis have been studied to ascertain the effect on the structure and function of the testis, taking the normal side as control. There was no pressure effect from the hydrocele on the structure of the testis in 70 per cent, a flattening of testis in 22 per cent, and atrophy of testis in 8 per cent of cases. There was partial arrest of spermatogenesis in 10 per cent and total arrest of spermatogenesis in 8 per cent of cases. The remaining 82 per cent showed normal spermatogenesis.",202,"1","2024-04-24T21:07:14.491474Z",198,6.16,"5","2024-04-24T21:07:14.491474Z"
"Effects of tracheal irritation and hypercapnia on tracheal smooth muscle in humans. Both hypercapnia and tracheal irritation are known to constrict the airways in animals. To see whether similar responses occur in humans, we investigated tracheal smooth muscle (TSM) responses to hypercapnia and tracheal irritation with water in 14 paralyzed and anesthetized humans. TSM tone was monitored by measuring the pressure in the saline-filled cuff of the endotracheal tube. Although, tracheal irritation caused TSM constriction in 10 of 14 patients, 4 patients showed no TSM response. Administration of intravenous atropine attenuated the TSM constriction response. Hypercapnia did not cause any change in TSM tone in any of the 14 patients. These results indicate that in paralyzed and anesthetized humans, there exist interindividual differences in the TSM responses to tracheal irritation and that hypercapnia cannot be an effective stimulus for the TSM constriction.",203,"1","2024-04-24T21:07:25.457632Z",199,9.783,"5","2024-04-24T21:07:25.457632Z"
"Proximal gastric vagotomy in the emergency treatment of bleeding duodenal ulcer. Proximal gastric vagotomy for bleeding duodenal ulcer was performed in 52 low-risk patients between 1973 and 1986. Duodenotomy without violation of the pylorus was done in all patients to allow inspection and control of the bleeding site. The median duration of operation was 3 hours and 20 minutes, although 25% of the procedures required 4 or more hours. There was no postoperative mortality and no early reoperations. Among the six patients with postoperative complications, one rebled from the ulcer and two developed prolonged gastric atony. At the time of follow-up (median, 2.9 years), 48 of the patients were alive and 4 had died of non-ulcer causes. No patient had significant postvagotomy sequelae. Ulcer recurrence was documented in six patients, and three required reoperation. Proximal gastric vagotomy is a safe, effective therapy for bleeding duodenal ulcer. Because of the length of the operation, it should be restricted to low-risk patients who are hemodynamically stable at the time of operation.",204,"1","2024-04-24T21:08:06.572144Z",200,8.091,"2","2024-04-24T21:08:06.572144Z"
"Spontaneous infarction of placental chorioangioma and associated regression of hydrops fetalis. We report a case of a large chorioangioma diagnosed prenatally with concomitant meconium peritonitis and hydrops fetalis in the second trimester. Spontaneous regression of the tumor occurred, associated with some resolution of the fetal hydrops and delivery near term with good neonatal outcome.",205,"1","2024-04-24T21:08:20.215175Z",201,12.427,"5","2024-04-24T21:08:20.215175Z"
"Benign parotid tumors: a 24-year experience. The medical records of 125 patients benign parotid neoplasms surgically treated over a 24-year period were retrospectively reviewed; 128 tumors were excised. These included 90 pleomorphic adenomas, 33 Warthin's tumors, 3 benign lymphoepitheliomas, and 2 oncocytomas. The surgical procedures consisted of 2 local excisions, 6 enucleations, 88 superficial parotidectomies, 13 subtotal parotidectomies, and 3 radical parotidectomies. The morbidity rate was 49%. There was one total permanent facial nerve paralysis (0.7%), four (3%) partial permanent facial nerve paralysis, five (5%) transient total facial nerve paralysis, and 32 (25%) partial transient facial nerve paralysis. After a median follow-up of 84 months, there was one recurrence (0.7%). A superficial parotidectomy is the minimum procedure that should be performed for the treatment of a benign parotid neoplasm.",206,"1","2024-04-24T21:08:26.984712Z",202,5.72,"1","2024-04-24T21:08:26.984712Z"
"Familial autosomal recessive rigid spine syndrome with neurogenic facio-scapulo-peroneal muscle atrophy. Two sisters and a first cousin presented with rigid spine and facio-scapulo-peroneal muscle atrophy. The patients belonged to a family with two first-cousin marriages. Electromyography, muscle and nerve biopsy showed neurogenic muscle atrophy without peripheral nerve involvement. Follow up did not show progression of the disease. This is the first observation of an association of neurogenic facio-scapulo-peroneal and rigid spine syndrome. The double first-cousin marriage suggests autosomal recessive inheritance.",207,"1","2024-04-24T21:08:49.597759Z",203,21.542,"5","2024-04-24T21:08:49.597759Z"
"Results of treatment of persistent hyperplastic primary vitreous. The records of 48 patients with persistent hyperplastic primary vitreous (PHPV) were reviewed. Approximately 17% had vision of 20/100 or better after surgery, contact lens fitting, and amblyopia therapy. Only eyes with a purely anterior presentation had successful visual outcomes. Lensectomy alone prevented glaucoma, but a membranectomy as well was required to ensure a successful visual result. Eyes with a posterior PHPV had poor visual results because of posterior pole abnormalities. I recommend that an attempt be made to visually salvage eyes with an anterior presentation. Eyes with a posterior or a combination anterior-posterior PHPV can be successfully treated for glaucoma, but the visual results will be poor.",208,"1","2024-04-24T21:09:03.879200Z",204,13.195,"5","2024-04-24T21:09:03.879200Z"
"Endocarditis in the 80s in a general hospital in Auckland, New Zealand. The clinical and investigative features of 102 episodes of infective endocarditis were analysed retrospectively. The most frequent presenting symptoms (malaise, fever, sweats, myalgia, weight loss) were non-specific. Fever, cardiac murmur, tachycardia, vascular phenomena and a change in mental state were the most common physical signs at admission. Anaemia was present in half the episodes and renal and liver dysfunction in about one-third. Streptococci (61) and staphylococci (31) were the causative organisms in all but 10 episodes. The commonest predisposing factors were underlying cardiac disease (52 per cent) and a preceding focus of infection (14.6 per cent). Left ventricular failure (33 per cent) and focal neurological disease (29 per cent) occurred frequently. Valvular surgery was performed in 20 episodes, with two in-hospital deaths. Overall hospital mortality was 27.5 per cent and death was most commonly neurological (11/28). A higher mortality was associated with elevated total white blood count, microscopic haematuria, renal or liver dysfunction at admission, S. aureus endocarditis, the development of left ventricular failure or focal neurological disease, age greater than or equal to 60 years and persistence of fever after one week of antibiotic therapy. The absence of both renal dysfunction at admission and subsequent microscopic haematuria identified a group with a very low hospital mortality (4.7 per cent). The three-year mortality of the entire group was 43.5 per cent.",209,"1","2024-04-24T21:09:15.389668Z",205,8.91,"4","2024-04-24T21:09:15.389668Z"
"Whither short-course chemotherapy for tuberculous meningitis? Short-course chemotherapy is well established for the treatment of pulmonary tuberculosis but not for extrapulmonary disease. We present a series of 35 cases in which chemotherapy for tuberculous meningitis was given for a period of less than 2 years. Short-term therapy was associated with recrudescence of tuberculous meningitis and, in some cases, with the development of deep cerebral infarcts and permanent neurological deficits. We think short-term chemotherapy for tuberculosis of the central nervous system is inadequate.",210,"1","2024-04-24T21:09:35.105106Z",206,18.595,"5","2024-04-24T21:09:35.105106Z"
"Parental age in sporadic hereditary retinoblastoma. Of 104 children with sporadic hereditary retinoblastoma born between 1945 and 1970, we studied the age of their parents at the birth and compared this age with the mean age of parents at the birth of their children during the same period in The Netherlands. The mean age of fathers at the birth of their children with sporadic hereditary retinoblastoma (33.7 years) was significantly higher than the mean age of fathers at the birth of their children in the general population (32.5 years) (P less than .05, one sided). Similarly, the mean age of mothers at the birth of their children with sporadic hereditary retinoblastoma (31.2 years) was significantly higher than the mean age of mothers at the birth of their children in the general population (29.5 years) (P less than .05, one sided). We further analyzed this parental age factor by measuring the relative risk of age groups and comparing the incidence of sporadic hereditary retinoblastoma in the various parental age groups with the incidence of sporadic hereditary retinoblastoma in the total population. Mothers 35 years of age or older had a relative risk of 1.7 to have a child with sporadic hereditary retinoblastoma compared with mothers in the population in general (P = .006, one sided). Similarly, fathers 50 years of age or older had a relative risk of 5.0 to have a child with sporadic hereditary retinoblastoma compared with fathers in the population in general (P = .04, one sided). No parental age effect was found in children with nonhereditary retinoblastoma. We conclude that a high paternal and a high maternal age are significant risk factors for sporadic hereditary retinoblastoma.",211,"1","2024-04-24T21:09:48.777264Z",207,12.105,"1","2024-04-24T21:09:48.777264Z"
"The frequency, causes and timing of death within 30 days of a first stroke: the Oxfordshire Community Stroke Project. In a prospective, community-based study of 675 consecutive patients with a first-ever stroke, of whom over 90% had computed tomography (CT) and/or necropsy examinations, 129 deaths occurred within 30 days of the onset of symptoms, a case fatality rate (CFR) of 19%. The 30 day CFR for patients with cerebral infarction was 10% (57 of 545, for primary intracerebral haemorrhage 52% (34 of 66), for subarachnoid haemorrhage 45% (15 of 33) and for those of uncertain pathological type 74% (23 of 31). The CFR for patients who had been functionally dependent pre-stroke was 33% compared with 17% for those who had been independent pre-stroke. The age-adjusted relative risk of death for patients who had been functionally dependent pre-stroke was not significantly greater (1.8, 95% confidence interval 0 to 4.3). There was a significant trend for CFR to increase with age (Chi square for trend = 4.0, p less than 0.05). This relationship was found in those patients who had been functionally independent prestroke (Chi square for trend = 7.9, p less than 0.005) but not in those who had been dependent pre-stroke (Chi square for trend = 0.5, NS). The pattern of increasing CFR with increasing age amongst those who had been independent prestroke was seen particularly in patients with cerebral infarction (Chi square for trend = 8.6, p less than 0.005). The age-adjusted relative risk of death for patients with cerebral infarction who had been functionally dependent pre-stroke was 2.2 (95% confidence interval 1.2 to 4.1). Fifty three percent of all deaths within 30 days of stroke were due to the direct neurological sequelae of the stroke.",212,"1","2024-04-24T21:09:58.251027Z",208,8.288,"3","2024-04-24T21:09:58.251027Z"
"Beta-adrenergic receptors in lymphocyte subsets after exercise. Alterations in normal individuals and patients with congestive heart failure. Dynamic exercise increases the number of beta-adrenergic receptors in mixed lymphocytes by a mechanism that is incompletely understood. In a set of in vivo studies, we have investigated the effects of dynamic exercise on the subset distribution of circulating lymphocytes and on the number of beta-adrenergic receptors in each of these subsets in two groups of patients. In healthy subjects, exercise increased plasma norepinephrine and epinephrine and caused lymphocytosis. Whereas the number of Thelper cells increased only modestly, the number of Tsuppressor/cytotoxic and natural killer cells more than tripled. The number of beta-adrenergic receptors varied among subsets but was not significantly altered by dynamic exercise in any subset except natural killer cells (35% increase, p = 0.0302). In a group of patients with congestive heart failure, dynamic exercise increased plasma norepinephrine but did not alter plasma epinephrine and did not cause significant lymphocytosis. We did not detect any significant alterations of circulating leukocyte subsets or beta-adrenergic receptors in any of these subsets after exercise. A combined analysis of healthy patients and heart failure patients revealed a significant correlation between increases in plasma epinephrine and increases in circulating lymphocytes. We conclude that the exercise-induced increase in beta-adrenergic receptors of mixed lymphocytes is predominantly caused by a redistribution of circulating cell subsets that differ in their beta-adrenergic receptor number. This appears to be mediated by epinephrine rather than norepinephrine.",213,"1","2024-04-24T21:10:09.466147Z",209,10.071,"4","2024-04-24T21:10:09.466147Z"
"Surgical treatment of brain metastases in malignant melanoma. The authors report the results of a retrospective review of 13 patients who underwent 19 craniotomies for resection of metastatic malignant melanoma at the University of Colorado (Denver, CO) between 1983 and 1989. There was preoperative evidence of extracranial disease in 11 patients. Eight patients had more than one intracranial metastasis at operation. Intraoperative ultrasound was used in 18 of the 19 craniotomies to minimize surgical trauma to the brain. The 30-day mortality was zero. The 30-day morbidity was minimal. No patient acquired a new neurologic deficit as a result of surgery. All patients regained at least their preoperative level of functioning. Six of the patients who were living at the time of review have been followed for 4 to 25 months (median, 7.5 months). The seven patients who were dead at the time of review survived 4 to 18 months (median, 10 months). These results compare favorably with the survival of untreated patients with metastatic melanoma to the brain (median, 1 month), patients treated with radiation therapy alone (median, 2-4 months), and those treated with chemotherapy alone (median, 2-4 months). The excision of metastatic melanoma from the brain, although not curative, may increase survival in patients with this problem with little morbidity and mortality even in the presence of other metastases.",214,"1","2024-04-24T21:10:18.641269Z",210,8.07,"1","2024-04-24T21:10:18.641269Z"
"Imaging of a parapharyngeal hemangiopericytoma. Radioimmunoscintigraphy (SPECT) with indium-111-labeled anti-CEA antibody, and comparison to digital subtraction angiography, computed tomography, and immunohistochemistry. A 27-year-old male patient with a parapharyngeal hemangiopericytoma was investigated radiologically with orthopantomography, computed tomography, and digital subtraction angiography before the operation. Because a malignancy was suspected, the patient was imaged with gamma camera using radiolabeled monoclonal anticarcinoembryonal antigen antibody including single photon emission computed tomography. The radioantibody accumulated strongly into the neoplasm. Tumor to background ratio was 2.2. Samples of the excised tumor were stained immunohistochemically for desmin, vimentin, muscle actin, cytokeratin, CEA (carcinoembryonic antigen), and factor VIII. They showed that the antibody uptake was of unspecific nature and not due to CEA expression in the tumor.",215,"1","2024-04-24T21:10:40.893500Z",211,19.955,"1","2024-04-24T21:10:40.893500Z"
"Proximal posterior cerebral artery occlusion simulating middle cerebral artery occlusion. We describe 12 cases of acute stroke in which clinical features of proximal posterior cerebral artery occlusion simulated the clinical syndrome of middle cerebral artery occlusion. The majority of patients developed contralateral hemiparesis, homonymous hemianopia, hemispatial neglect, and sensory loss or sensory inattention. All 8 patients with dominant hemisphere lesions were aphasic. Accurate diagnosis in each case was achieved only after a head CT, showing occipital lobe, thalamic, and inferomesial temporal lobe infarction. ""Cortical"" signs are probably explained by thalamic involvement. Recognition of this syndrome has implications for management and prognosis.",216,"1","2024-04-24T21:11:15.201020Z",212,31.409,"4","2024-04-24T21:11:15.201020Z"
"Metastasizing pleomorphic adenoma of the nasal septum. Pleomorphic adenoma is the most common benign tumor of glandular tissue occurring in the head and neck region. There have been several reports of metastasis of this benign-appearing tumor from the salivary glands to distant sites, suggesting hematogenous spread and implantation. Although occurrence of pleomorphic adenoma on the nasal septum has been described, to our knowledge this is the first reported case of recurrent septal pleomorphic adenoma with histologically benign tissue in an enlarged metastatic ipsilateral submandibular lymph node, suggesting lymphatic spread. The literature concerning the subject is reviewed. Wide septal excision and modified neck dissection is the recommended treatment.",217,"1","2024-04-24T21:11:23.367142Z",213,6.945,"1","2024-04-24T21:11:23.367142Z"
"The value of routine preoperative laboratory testing in predicting postoperative complications: a multivariate analysis. The purpose of this study was to evaluate the ability of preoperative laboratory testing to predict postoperative complications. Five hundred twenty patients undergoing elective surgery had their American Society of Anesthesiologists' classification, ponderal index, electrolyte values, glucose levels, blood urea nitrogen/creatinine values, complete blood counts, coagulation studies, total protein/albumin/lymphocyte count, electrocardiogram, chest radiograph, urinalysis, pulmonary function tests, type of anesthesia, and type of operation recorded preoperatively. Patients were followed prospectively after surgery for the development of complications. The data were analyzed by univariate and multivariate methods. Postoperative complications were strongly associated with American Society of Anesthesiologists' classification, type of anesthesia, and type of operation. However, only a few laboratory tests, such as electrocardiogram, chest radiograph, and nutritional status, were associated with postoperative complications. Therefore, in general, preoperative laboratory testing should only be undertaken for specific indications. Recommendations for routine tests are made depending on the age of the patient.",218,"1","2024-04-24T21:11:45.535700Z",214,20.98,"5","2024-04-24T21:11:45.535700Z"
"Adenoid cystic carcinoma of the esophagus. A clinicopathologic study of three cases. In a group of 245 cases of primary carcinoma of the esophagus the authors found three cases of adenoid cystic carcinoma (ACC). Clinical and pathologic data of those patients (one female and two male; age range, 49-74 years) were analyzed. Tumors were localized in the middle third of the esophagus. One patient lived 15 months after surgery. Another is a case of early ACC who has been living 4.5 years after surgery and is without specific symptoms. The third patient had not had surgery and died 13 months after the onset of dysphagia. An autopsy showed only a locally invasive tumor growing into the surroundings of the esophagus, and regional lymph node metastases without distant parenchymal metastases. These findings support pathologic and biologic similarities between ACC of the esophagus and ACC of the salivary glands. There are synchronous tumors of the esophagus and the vital localization which makes the prognosis of ACC of the esophagus worse than ACC of the salivary glands.",219,"1","2024-04-24T21:11:52.523486Z",215,5.907,"1","2024-04-24T21:11:52.523486Z"
"Quantitative proton magnetic resonance imaging in focal cerebral ischemia in rat brain. Proton magnetic resonance (MR) imaging has been recommended as a diagnostic tool for the detection of focal cerebral ischemia. We compared microscopic MR images of rat brains after focal cerebral ischemia with evidence of histological damage found on corresponding silver-impregnated or cresyl violet-stained brain sections. Ten male Wistar rats were subjected to permanent unilateral occlusions of the right middle cerebral and common carotid arteries under halothane anesthesia. Twenty-four hours later the area of injury on MR images amounted to 26% of the total slice area, whereas only 9% of the total slice area was necrotic on histological sections from the same animals. The infarcted areas on tissue sections were surrounded by regions of selective neuronal injury in the cerebral cortex and occasionally in the hippocampus. The area of injury on MR images was larger than the combined areas of infarction and selective neuronal injury on histological sections. Areas of increased T2 values on MR images extended medially into noninfarcted striatum and laterally and dorsally into noninfarcted cortex. The lateral and dorsal areas on MR images frequently coincided with cortical areas in which considerable selective neuronal injury was present in the upper cortical layers. We hypothesize that the abnormal areas on MR images above histologically normal brain tissue represent the ischemic penumbra. If true, this is the first demonstration of the ischemic penumbra by MR imaging and may reflect our use of Wistar rats, a new image analysis technique, and ultra-high resolution MR imaging.",220,"1","2024-04-24T21:12:01.026668Z",216,7.289,"3","2024-04-24T21:12:01.026668Z"
